{
  "$schema": "https://docs.wrangles.com/registry/schema/wrangle-contract.schema.json",
  "format": "wrangles-registry-entry",
  "registry_version": "0.3.0",
  "schema_version": "0.3",
  "type": "wrangle",
  "catalog_id": "82",
  "catalog_key": "math",
  "catalog_status": "active",
  "legacy_id": "494b11ad-00c1-4748-8b93-6bec982f4fec",
  "wrangle_name": "math",
  "namespace": null,
  "wrangle_key": "math",
  "aliases": [],
  "slug": "math",
  "title": "Math",
  "description": "Apply a mathematical calculation.",
  "status": "active",
  "visibility": "public",
  "recipe_writer": {
    "eligible": true
  },
  "tags": [
    "compute",
    "math"
  ],
  "runtime": {
    "package": "wrangles",
    "symbol": "wrangles.recipe_wrangles.main.math",
    "contract_status": "verified"
  },
  "access": {
    "ai_powered": false,
    "requires_account": false,
    "requires_subscription": false,
    "requires_external_api_key": false
  },
  "capabilities": {
    "if": true,
    "where": true,
    "where_params": true
  },
  "configuration_schema": {
    "type": "object",
    "description": "Apply a mathematical calculation.",
    "additionalProperties": false,
    "required": [
      "input",
      "output"
    ],
    "properties": {
      "input": {
        "type": [
          "string",
          "integer"
        ],
        "description": "The mathematical expression using column names. e.g. column1 * column2\n+ column3.  Note: spaces within column names are replaced by underscores (_).\n"
      },
      "output": {
        "type": "string",
        "description": "The column to output the results to"
      },
      "if": {
        "$ref": "https://docs.wrangles.com/schemas/recipes/registry/schema.json#/$defs/wrangles/commonProperties/if"
      },
      "where": {
        "$ref": "https://docs.wrangles.com/schemas/recipes/registry/schema.json#/$defs/wrangles/commonProperties/where"
      },
      "where_params": {
        "$ref": "https://docs.wrangles.com/schemas/recipes/registry/schema.json#/$defs/wrangles/commonProperties/where_params"
      }
    }
  },
  "schema_origin": "upstream-docstring",
  "schema_adjustments": [],
  "schema_source": {
    "repository": "https://github.com/wrangleworks/WranglesPY",
    "revision": "bd5f88fba479ec406b409cb2880689c54e72b298",
    "version": "1.20.5",
    "extraction": "static-python-ast"
  },
  "parameters": [
    {
      "name": "input",
      "description": "The mathematical expression using column names. e.g. column1 * column2\n+ column3.  Note: spaces within column names are replaced by underscores (_).\n",
      "required": true,
      "param_group": "I/O",
      "schema": {
        "type": [
          "string",
          "integer"
        ],
        "description": "The mathematical expression using column names. e.g. column1 * column2\n+ column3.  Note: spaces within column names are replaced by underscores (_).\n"
      },
      "runtime_required": true
    },
    {
      "name": "output",
      "description": "The column to output the results to",
      "required": true,
      "param_group": "I/O",
      "schema": {
        "type": "string",
        "description": "The column to output the results to"
      },
      "runtime_required": true
    },
    {
      "name": "if",
      "description": "Condition that determines whether the wrangle runs as a whole. Recipe variables may be referenced with `${variable}`.",
      "required": false,
      "param_group": "Conditions",
      "schema": {
        "type": "string"
      }
    },
    {
      "name": "where",
      "description": "Filter rows before applying the wrangle using SQL-like criteria, such as `column1 = 123 OR column2 = 'abc'`.",
      "required": false,
      "param_group": "Conditions",
      "schema": {
        "type": "string"
      }
    },
    {
      "name": "where_params",
      "description": "Values used with `where` for parameterized criteria. Uses SQLite placeholder syntax such as `?` or `:name`.",
      "required": false,
      "param_group": "Conditions",
      "schema": {
        "type": [
          "array",
          "object"
        ]
      }
    }
  ],
  "examples": [],
  "guidance": "Apply mathematical calculations to columns. Also called as `maths`.\n\n:::info\nSpaces within column headers are replaced with underscores automatically. Account for this when writing expressions in `input`.\n:::\n\n## Migrated examples\n#### Square Root Example\n\n##### Recipe\n\n```yaml\nwrangles:\n  - math:\n      input: sqrt(Values)\n      output: Square Root\n```\n\n<div className=\"ww-sample-grid\">\n\n<div className=\"ww-sample-panel\">\n\n##### Input Sample\n\n| Values |\n| --- |\n| 4 |\n| 9 |\n| 16 |\n\n</div>\n\n<div className=\"ww-sample-panel\">\n\n##### Output Sample\n\n| Values | Square Root |\n| --- | --- |\n| 4 | 2 |\n| 9 | 3 |\n| 16 | 4 |\n\n</div>\n\n</div>",
  "sources": [
    {
      "id": "runtime",
      "resource": "https://github.com/wrangleworks/WranglesPY/blob/7916bf158e8b7e561270a1bea7b808f88956edc4/wrangles/recipe_wrangles/main.py",
      "title": "WranglesPY math implementation"
    },
    {
      "id": "legacy-docs-archive",
      "resource": "https://github.com/wrangleworks/Wrangles-Docs/blob/6ad22fdaefc31154f38d7576e5e76746927daa69/wrangles-docs/wrangle-docs/compute/_sources/math.md",
      "title": "Archived math Markdown"
    }
  ]
}
