{
  "$schema": "https://docs.wrangles.com/registry/schema/wrangle-contract.schema.json",
  "format": "wrangles-registry-entry",
  "registry_version": "0.3.0",
  "schema_version": "0.3",
  "type": "wrangle",
  "catalog_id": "58",
  "catalog_key": "select.right",
  "catalog_status": "active",
  "legacy_id": "89ee82ec-3bc5-4bfa-899b-7a1260ef9bdb",
  "wrangle_name": "right",
  "namespace": "select",
  "wrangle_key": "select.right",
  "aliases": [],
  "slug": "select/right",
  "title": "Right",
  "description": "Return characters from the right of text. Strings shorter than the length defined will be unaffected.",
  "status": "active",
  "visibility": "public",
  "recipe_writer": {
    "eligible": true
  },
  "tags": [
    "select",
    "right"
  ],
  "runtime": {
    "package": "wrangles",
    "symbol": "wrangles.recipe_wrangles.select.right",
    "contract_status": "verified"
  },
  "access": {
    "ai_powered": false,
    "requires_account": false,
    "requires_subscription": false,
    "requires_external_api_key": false
  },
  "capabilities": {
    "if": true,
    "where": true,
    "where_params": true
  },
  "configuration_schema": {
    "type": "object",
    "description": "Return characters from the right of text. Strings shorter than the length defined will be unaffected.",
    "additionalProperties": false,
    "required": [
      "input",
      "length"
    ],
    "properties": {
      "input": {
        "type": [
          "string",
          "integer",
          "array"
        ],
        "description": "Name of the column(s) to edit"
      },
      "output": {
        "type": [
          "string",
          "array"
        ],
        "description": "Name of the output column(s)"
      },
      "length": {
        "type": "integer",
        "description": "Number of characters to include from the right. If negative, this will remove the specified number of characters from the right. May not equal 0."
      },
      "if": {
        "$ref": "https://docs.wrangles.com/schemas/recipes/registry/schema.json#/$defs/wrangles/commonProperties/if"
      },
      "where": {
        "$ref": "https://docs.wrangles.com/schemas/recipes/registry/schema.json#/$defs/wrangles/commonProperties/where"
      },
      "where_params": {
        "$ref": "https://docs.wrangles.com/schemas/recipes/registry/schema.json#/$defs/wrangles/commonProperties/where_params"
      }
    }
  },
  "schema_origin": "upstream-docstring",
  "schema_adjustments": [],
  "schema_source": {
    "repository": "https://github.com/wrangleworks/WranglesPY",
    "revision": "bd5f88fba479ec406b409cb2880689c54e72b298",
    "version": "1.20.5",
    "extraction": "static-python-ast"
  },
  "parameters": [
    {
      "name": "input",
      "description": "Name of the column(s) to edit",
      "required": true,
      "param_group": "I/O",
      "schema": {
        "type": [
          "string",
          "integer",
          "array"
        ],
        "description": "Name of the column(s) to edit"
      },
      "runtime_required": true
    },
    {
      "name": "length",
      "description": "Number of characters to include from the right. If negative, this will remove the specified number of characters from the right. May not equal 0.",
      "required": true,
      "param_group": "Options",
      "schema": {
        "type": "integer",
        "description": "Number of characters to include from the right. If negative, this will remove the specified number of characters from the right. May not equal 0."
      },
      "runtime_required": true
    },
    {
      "name": "output",
      "description": "Name of the output column(s)",
      "required": false,
      "param_group": "I/O",
      "runtime_default": null,
      "schema": {
        "type": [
          "string",
          "array"
        ],
        "description": "Name of the output column(s)"
      },
      "runtime_required": false
    },
    {
      "name": "if",
      "description": "Condition that determines whether the wrangle runs as a whole. Recipe variables may be referenced with `${variable}`.",
      "required": false,
      "param_group": "Conditions",
      "schema": {
        "type": "string"
      }
    },
    {
      "name": "where",
      "description": "Filter rows before applying the wrangle using SQL-like criteria, such as `column1 = 123 OR column2 = 'abc'`.",
      "required": false,
      "param_group": "Conditions",
      "schema": {
        "type": "string"
      }
    },
    {
      "name": "where_params",
      "description": "Values used with `where` for parameterized criteria. Uses SQLite placeholder syntax such as `?` or `:name`.",
      "required": false,
      "param_group": "Conditions",
      "schema": {
        "type": [
          "array",
          "object"
        ]
      }
    }
  ],
  "examples": [],
  "guidance": "Select characters from the right of the input. Using a negative length reverses the side of selection, selecting from the left.\n\n## Migrated examples\n#### Selecting the Three Rightmost Elements\n\n##### Recipe\n\n```yaml\nwrangles:\n  - select.right:\n      input: Column\n      output: Result\n      length: 3\n```\n\n<div className=\"ww-sample-grid\">\n\n<div className=\"ww-sample-panel\">\n\n##### Input Sample\n\n| Column |\n| --- |\n| pudding |\n\n</div>\n\n<div className=\"ww-sample-panel\">\n\n##### Output Sample\n\n| Result |\n| --- |\n| ing |\n\n</div>\n\n</div>",
  "sources": [
    {
      "id": "runtime",
      "resource": "https://github.com/wrangleworks/WranglesPY/blob/7916bf158e8b7e561270a1bea7b808f88956edc4/wrangles/recipe_wrangles/select.py",
      "title": "WranglesPY select.right implementation"
    },
    {
      "id": "legacy-docs-archive",
      "resource": "https://github.com/wrangleworks/Wrangles-Docs/blob/6ad22fdaefc31154f38d7576e5e76746927daa69/wrangles-docs/wrangle-docs/select/_sources/right.md",
      "title": "Archived select.right Markdown"
    }
  ]
}
