{
  "$schema": "https://docs.wrangles.com/registry/schema/wrangle-contract.schema.json",
  "format": "wrangles-registry-entry",
  "registry_version": "0.3.0",
  "schema_version": "0.3",
  "type": "wrangle",
  "catalog_id": "31",
  "catalog_key": "format.dates",
  "catalog_status": "active",
  "legacy_id": "a3c15135-4f7a-4659-83fd-f657afa603c9",
  "wrangle_name": "dates",
  "namespace": "format",
  "wrangle_key": "format.dates",
  "aliases": [],
  "slug": "format/dates",
  "title": "Dates",
  "description": "Format a date.",
  "status": "active",
  "visibility": "public",
  "recipe_writer": {
    "eligible": true
  },
  "tags": [
    "format",
    "dates"
  ],
  "runtime": {
    "package": "wrangles",
    "symbol": "wrangles.recipe_wrangles.format.dates",
    "contract_status": "verified"
  },
  "access": {
    "ai_powered": false,
    "requires_account": false,
    "requires_subscription": false,
    "requires_external_api_key": false
  },
  "capabilities": {
    "if": true,
    "where": true,
    "where_params": true
  },
  "configuration_schema": {
    "type": "object",
    "description": "Format a date",
    "additionalProperties": false,
    "required": [
      "input",
      "format"
    ],
    "properties": {
      "input": {
        "type": [
          "string",
          "integer",
          "array"
        ],
        "description": "Name of the input column"
      },
      "output": {
        "type": [
          "string",
          "array"
        ],
        "description": "Name of the output column"
      },
      "format": {
        "type": [
          "string"
        ],
        "description": "String pattern to format date"
      },
      "if": {
        "$ref": "https://docs.wrangles.com/schemas/recipes/registry/schema.json#/$defs/wrangles/commonProperties/if"
      },
      "where": {
        "$ref": "https://docs.wrangles.com/schemas/recipes/registry/schema.json#/$defs/wrangles/commonProperties/where"
      },
      "where_params": {
        "$ref": "https://docs.wrangles.com/schemas/recipes/registry/schema.json#/$defs/wrangles/commonProperties/where_params"
      }
    }
  },
  "schema_origin": "upstream-docstring",
  "schema_adjustments": [],
  "schema_source": {
    "repository": "https://github.com/wrangleworks/WranglesPY",
    "revision": "bd5f88fba479ec406b409cb2880689c54e72b298",
    "version": "1.20.5",
    "extraction": "static-python-ast"
  },
  "parameters": [
    {
      "name": "input",
      "description": "Name of the input column",
      "required": true,
      "param_group": "I/O",
      "schema": {
        "type": [
          "string",
          "integer",
          "array"
        ],
        "description": "Name of the input column"
      },
      "runtime_required": true
    },
    {
      "name": "format",
      "description": "String pattern to format date",
      "required": true,
      "param_group": "Formatting",
      "schema": {
        "type": [
          "string"
        ],
        "description": "String pattern to format date"
      },
      "runtime_required": true
    },
    {
      "name": "output",
      "description": "Name of the output column",
      "required": false,
      "param_group": "I/O",
      "runtime_default": null,
      "schema": {
        "type": [
          "string",
          "array"
        ],
        "description": "Name of the output column"
      },
      "runtime_required": false
    },
    {
      "name": "if",
      "description": "Condition that determines whether the wrangle runs as a whole. Recipe variables may be referenced with `${variable}`.",
      "required": false,
      "param_group": "Conditions",
      "schema": {
        "type": "string"
      }
    },
    {
      "name": "where",
      "description": "Filter rows before applying the wrangle using SQL-like criteria, such as `column1 = 123 OR column2 = 'abc'`.",
      "required": false,
      "param_group": "Conditions",
      "schema": {
        "type": "string"
      }
    },
    {
      "name": "where_params",
      "description": "Values used with `where` for parameterized criteria. Uses SQLite placeholder syntax such as `?` or `:name`.",
      "required": false,
      "param_group": "Conditions",
      "schema": {
        "type": [
          "array",
          "object"
        ]
      }
    }
  ],
  "examples": [],
  "guidance": "Format a date into the desired pattern.\n\n## Migrated examples\n#### Changing The Format of a Date\n\n##### Recipe\n\n```yaml\nwrangles:\n  - format.dates:\n      input: Date\n      output: Output Format\n      format: '%Y-%m-%d'  # must be wrapped by quotes \" or '\n```\n\n<div className=\"ww-sample-grid\">\n\n<div className=\"ww-sample-panel\">\n\n##### Input Sample\n\n| Date |\n| --- |\n| 6/23/1912 |\n\n</div>\n\n<div className=\"ww-sample-panel\">\n\n##### Output Sample\n\n| Date | Output Format |\n| --- | --- |\n| 6/23/1912 | 1912-06-23 |\n\n</div>\n\n</div>",
  "sources": [
    {
      "id": "runtime",
      "resource": "https://github.com/wrangleworks/WranglesPY/blob/7916bf158e8b7e561270a1bea7b808f88956edc4/wrangles/recipe_wrangles/format.py",
      "title": "WranglesPY format.dates implementation"
    },
    {
      "id": "legacy-docs-archive",
      "resource": "https://github.com/wrangleworks/Wrangles-Docs/blob/6ad22fdaefc31154f38d7576e5e76746927daa69/wrangles-docs/wrangle-docs/format/_sources/dates.md",
      "title": "Archived format.dates Markdown"
    }
  ]
}
