{
  "$schema": "https://docs.wrangles.com/registry/schema/wrangle-contract.schema.json",
  "format": "wrangles-registry-entry",
  "registry_version": "0.3.0",
  "schema_version": "0.3",
  "type": "wrangle",
  "catalog_id": "53",
  "catalog_key": "select.head",
  "catalog_status": "active",
  "legacy_id": "237af1ec-db7d-415a-88b7-70586a2191fb",
  "wrangle_name": "head",
  "namespace": "select",
  "wrangle_key": "select.head",
  "aliases": [],
  "slug": "select/head",
  "title": "Head",
  "description": "Return the first n rows.",
  "status": "active",
  "visibility": "public",
  "recipe_writer": {
    "eligible": true
  },
  "tags": [
    "select",
    "head"
  ],
  "runtime": {
    "package": "wrangles",
    "symbol": "wrangles.recipe_wrangles.select.head",
    "contract_status": "verified"
  },
  "access": {
    "ai_powered": false,
    "requires_account": false,
    "requires_subscription": false,
    "requires_external_api_key": false
  },
  "capabilities": {
    "if": true,
    "where": true,
    "where_params": true
  },
  "configuration_schema": {
    "type": "object",
    "description": "Return the first n rows",
    "required": [
      "n"
    ],
    "properties": {
      "n": {
        "type": "integer",
        "description": "Number of rows to return"
      },
      "if": {
        "$ref": "https://docs.wrangles.com/schemas/recipes/registry/schema.json#/$defs/wrangles/commonProperties/if"
      },
      "where": {
        "$ref": "https://docs.wrangles.com/schemas/recipes/registry/schema.json#/$defs/wrangles/commonProperties/where_special"
      },
      "where_params": {
        "$ref": "https://docs.wrangles.com/schemas/recipes/registry/schema.json#/$defs/wrangles/commonProperties/where_params"
      }
    }
  },
  "schema_origin": "upstream-docstring",
  "schema_adjustments": [],
  "schema_source": {
    "repository": "https://github.com/wrangleworks/WranglesPY",
    "revision": "bd5f88fba479ec406b409cb2880689c54e72b298",
    "version": "1.20.5",
    "extraction": "static-python-ast"
  },
  "parameters": [
    {
      "name": "n",
      "description": "Number of rows to return",
      "required": true,
      "param_group": "Options",
      "schema": {
        "type": "integer",
        "description": "Number of rows to return"
      },
      "runtime_required": true
    },
    {
      "name": "if",
      "description": "Condition that determines whether the wrangle runs as a whole. Recipe variables may be referenced with `${variable}`.",
      "required": false,
      "param_group": "Conditions",
      "schema": {
        "type": "string"
      }
    },
    {
      "name": "where",
      "description": "Filter rows before applying the wrangle using SQL-like criteria, such as `column1 = 123 OR column2 = 'abc'`.",
      "required": false,
      "param_group": "Conditions",
      "schema": {
        "type": "string"
      }
    },
    {
      "name": "where_params",
      "description": "Values used with `where` for parameterized criteria. Uses SQLite placeholder syntax such as `?` or `:name`.",
      "required": false,
      "param_group": "Conditions",
      "schema": {
        "type": [
          "array",
          "object"
        ]
      }
    }
  ],
  "examples": [],
  "guidance": "Return the first n rows\n\n## Migrated examples\n#### Selecting The First n Rows\n\n##### Recipe\n\n```yaml\nwrangles:\n  - select.head:\n      n: 2\n```\n\n<div className=\"ww-sample-grid\">\n\n<div className=\"ww-sample-panel\">\n\n##### Input Sample\n\n| Product | Manufacturer |\n| --- | --- |\n| Ball Bearing | SKF |\n| Bearing Race | Timken |\n| Needle Bearing | Acme Bearings |\n| Roller Bearing | General Bearing Co. |\n\n</div>\n\n<div className=\"ww-sample-panel\">\n\n##### Output Sample\n\n| Product | Manufacturer |\n| --- | --- |\n| Ball Bearing | SKF |\n| Bearing Race | Timken |\n\n</div>\n\n</div>",
  "sources": [
    {
      "id": "runtime",
      "resource": "https://github.com/wrangleworks/WranglesPY/blob/7916bf158e8b7e561270a1bea7b808f88956edc4/wrangles/recipe_wrangles/select.py",
      "title": "WranglesPY select.head implementation"
    },
    {
      "id": "legacy-docs-archive",
      "resource": "https://github.com/wrangleworks/Wrangles-Docs/blob/6ad22fdaefc31154f38d7576e5e76746927daa69/wrangles-docs/wrangle-docs/select/_sources/head.md",
      "title": "Archived select.head Markdown"
    }
  ]
}
