{
  "$schema": "https://docs.wrangles.com/registry/schema/wrangle-contract.schema.json",
  "format": "wrangles-registry-entry",
  "registry_version": "0.3.0",
  "schema_version": "0.3",
  "type": "wrangle",
  "catalog_id": "44",
  "catalog_key": "merge.lists",
  "catalog_status": "active",
  "legacy_id": "d9978f00-b3d4-4583-884e-a53b98a43e9a",
  "wrangle_name": "lists",
  "namespace": "merge",
  "wrangle_key": "merge.lists",
  "aliases": [],
  "slug": "merge/lists",
  "title": "Lists",
  "description": "Take lists in multiple columns and merge them to a single list.",
  "status": "active",
  "visibility": "public",
  "recipe_writer": {
    "eligible": true
  },
  "tags": [
    "merge",
    "lists"
  ],
  "runtime": {
    "package": "wrangles",
    "symbol": "wrangles.recipe_wrangles.merge.lists",
    "contract_status": "verified"
  },
  "access": {
    "ai_powered": false,
    "requires_account": false,
    "requires_subscription": false,
    "requires_external_api_key": false
  },
  "capabilities": {
    "if": true,
    "where": true,
    "where_params": true
  },
  "configuration_schema": {
    "type": "object",
    "description": "Take lists in multiple columns and merge them to a single list.",
    "additionalProperties": false,
    "required": [
      "input",
      "output"
    ],
    "properties": {
      "input": {
        "type": "array",
        "description": "List of input columns"
      },
      "output": {
        "type": "string",
        "description": "Name of the output column"
      },
      "remove_duplicates": {
        "type": "boolean",
        "description": "Whether to remove duplicates from the created list"
      },
      "ignore_case": {
        "type": "boolean",
        "description": "Ignore case when removing duplicates"
      },
      "include_empty": {
        "type": "boolean",
        "description": "Whether to include empty values in the created list"
      },
      "if": {
        "$ref": "https://docs.wrangles.com/schemas/recipes/registry/schema.json#/$defs/wrangles/commonProperties/if"
      },
      "where": {
        "$ref": "https://docs.wrangles.com/schemas/recipes/registry/schema.json#/$defs/wrangles/commonProperties/where"
      },
      "where_params": {
        "$ref": "https://docs.wrangles.com/schemas/recipes/registry/schema.json#/$defs/wrangles/commonProperties/where_params"
      }
    }
  },
  "schema_origin": "upstream-docstring",
  "schema_adjustments": [],
  "schema_source": {
    "repository": "https://github.com/wrangleworks/WranglesPY",
    "revision": "bd5f88fba479ec406b409cb2880689c54e72b298",
    "version": "1.20.5",
    "extraction": "static-python-ast"
  },
  "parameters": [
    {
      "name": "input",
      "description": "List of input columns",
      "required": true,
      "param_group": "I/O",
      "schema": {
        "type": "array",
        "description": "List of input columns"
      },
      "runtime_required": true
    },
    {
      "name": "output",
      "description": "Name of the output column",
      "required": true,
      "param_group": "I/O",
      "schema": {
        "type": "string",
        "description": "Name of the output column"
      },
      "runtime_required": true
    },
    {
      "name": "remove_duplicates",
      "description": "Whether to remove duplicates from the created list",
      "required": false,
      "param_group": "Options",
      "runtime_default": false,
      "schema": {
        "type": "boolean",
        "description": "Whether to remove duplicates from the created list"
      },
      "runtime_required": false
    },
    {
      "name": "ignore_case",
      "description": "Ignore case when removing duplicates",
      "required": false,
      "param_group": "Options",
      "runtime_default": false,
      "schema": {
        "type": "boolean",
        "description": "Ignore case when removing duplicates"
      },
      "runtime_required": false
    },
    {
      "name": "include_empty",
      "description": "Whether to include empty values in the created list",
      "required": false,
      "param_group": "Options",
      "runtime_default": true,
      "schema": {
        "type": "boolean",
        "description": "Whether to include empty values in the created list"
      },
      "runtime_required": false
    },
    {
      "name": "if",
      "description": "Condition that determines whether the wrangle runs as a whole. Recipe variables may be referenced with `${variable}`.",
      "required": false,
      "param_group": "Conditions",
      "schema": {
        "type": "string"
      }
    },
    {
      "name": "where",
      "description": "Filter rows before applying the wrangle using SQL-like criteria, such as `column1 = 123 OR column2 = 'abc'`.",
      "required": false,
      "param_group": "Conditions",
      "schema": {
        "type": "string"
      }
    },
    {
      "name": "where_params",
      "description": "Values used with `where` for parameterized criteria. Uses SQLite placeholder syntax such as `?` or `:name`.",
      "required": false,
      "param_group": "Conditions",
      "schema": {
        "type": [
          "array",
          "object"
        ]
      }
    }
  ],
  "examples": [],
  "guidance": "Take lists in multiple columns and merge them to a single list.\n\n## Migrated examples\n#### Merging Two Lists\n\n##### Recipe\n\n```yaml\nwrangles:\n  - merge.lists:\n      input:\n        - Col1\n        - Col2\n      output: Combined Col\n      remove_duplicates: false\n```\n\n<div className=\"ww-sample-grid\">\n\n<div className=\"ww-sample-panel\">\n\n##### Input Sample\n\n| Col1 | Col2 |\n| --- | --- |\n| ['A', 'B'] | ['D', 'E'] |\n\n</div>\n\n<div className=\"ww-sample-panel\">\n\n##### Output Sample\n\n| Combined Col |\n| --- |\n| ['A', 'B', 'D', 'E'] |\n\n</div>\n\n</div>",
  "sources": [
    {
      "id": "runtime",
      "resource": "https://github.com/wrangleworks/WranglesPY/blob/7916bf158e8b7e561270a1bea7b808f88956edc4/wrangles/recipe_wrangles/merge.py",
      "title": "WranglesPY merge.lists implementation"
    },
    {
      "id": "legacy-docs-archive",
      "resource": "https://github.com/wrangleworks/Wrangles-Docs/blob/6ad22fdaefc31154f38d7576e5e76746927daa69/wrangles-docs/wrangle-docs/merge/_sources/lists.md",
      "title": "Archived merge.lists Markdown"
    }
  ]
}
