{
  "$schema": "https://docs.wrangles.com/registry/schema/wrangle-contract.schema.json",
  "format": "wrangles-registry-entry",
  "registry_version": "0.3.0",
  "schema_version": "0.3",
  "type": "wrangle",
  "catalog_id": "26",
  "catalog_key": "extract.date_properties",
  "catalog_status": "active",
  "legacy_id": "a346de62-93cd-44ba-8d30-a6305629c6d7",
  "wrangle_name": "date_properties",
  "namespace": "extract",
  "wrangle_key": "extract.date_properties",
  "aliases": [],
  "slug": "extract/date-properties",
  "title": "Date Properties",
  "description": "Extract date properties from a date (day, month, year, etc...).",
  "status": "active",
  "visibility": "public",
  "recipe_writer": {
    "eligible": true
  },
  "tags": [
    "extract",
    "date-properties"
  ],
  "runtime": {
    "package": "wrangles",
    "symbol": "wrangles.recipe_wrangles.extract.date_properties",
    "contract_status": "verified"
  },
  "access": {
    "ai_powered": false,
    "requires_account": false,
    "requires_subscription": false,
    "requires_external_api_key": false
  },
  "capabilities": {
    "if": true,
    "where": true,
    "where_params": true
  },
  "configuration_schema": {
    "type": "object",
    "description": "Extract date properties from a date (day, month, year, etc...)",
    "additionalProperties": false,
    "required": [
      "input",
      "property"
    ],
    "properties": {
      "input": {
        "type": [
          "string",
          "integer",
          "array"
        ],
        "description": "Name of the input column"
      },
      "output": {
        "type": [
          "string",
          "array"
        ],
        "description": "Name of the output columns"
      },
      "property": {
        "type": "string",
        "description": "Property to extract from date",
        "enum": [
          "day",
          "day_of_year",
          "month",
          "month_name",
          "weekday",
          "week_day_name",
          "week_year",
          "quarter"
        ]
      },
      "if": {
        "$ref": "https://docs.wrangles.com/schemas/recipes/registry/schema.json#/$defs/wrangles/commonProperties/if"
      },
      "where": {
        "$ref": "https://docs.wrangles.com/schemas/recipes/registry/schema.json#/$defs/wrangles/commonProperties/where"
      },
      "where_params": {
        "$ref": "https://docs.wrangles.com/schemas/recipes/registry/schema.json#/$defs/wrangles/commonProperties/where_params"
      }
    }
  },
  "schema_origin": "upstream-docstring",
  "schema_adjustments": [],
  "schema_source": {
    "repository": "https://github.com/wrangleworks/WranglesPY",
    "revision": "bd5f88fba479ec406b409cb2880689c54e72b298",
    "version": "1.20.5",
    "extraction": "static-python-ast"
  },
  "parameters": [
    {
      "name": "input",
      "description": "Name of the input column",
      "required": true,
      "param_group": "I/O",
      "schema": {
        "type": [
          "string",
          "integer",
          "array"
        ],
        "description": "Name of the input column"
      },
      "runtime_required": true
    },
    {
      "name": "property",
      "description": "Property to extract from date",
      "required": true,
      "param_group": "Options",
      "schema": {
        "type": "string",
        "description": "Property to extract from date",
        "enum": [
          "day",
          "day_of_year",
          "month",
          "month_name",
          "weekday",
          "week_day_name",
          "week_year",
          "quarter"
        ]
      },
      "runtime_required": true
    },
    {
      "name": "output",
      "description": "Name of the output columns",
      "required": false,
      "param_group": "I/O",
      "runtime_default": null,
      "schema": {
        "type": [
          "string",
          "array"
        ],
        "description": "Name of the output columns"
      },
      "runtime_required": false
    },
    {
      "name": "if",
      "description": "Condition that determines whether the wrangle runs as a whole. Recipe variables may be referenced with `${variable}`.",
      "required": false,
      "param_group": "Conditions",
      "schema": {
        "type": "string"
      }
    },
    {
      "name": "where",
      "description": "Filter rows before applying the wrangle using SQL-like criteria, such as `column1 = 123 OR column2 = 'abc'`.",
      "required": false,
      "param_group": "Conditions",
      "schema": {
        "type": "string"
      }
    },
    {
      "name": "where_params",
      "description": "Values used with `where` for parameterized criteria. Uses SQLite placeholder syntax such as `?` or `:name`.",
      "required": false,
      "param_group": "Conditions",
      "schema": {
        "type": [
          "array",
          "object"
        ]
      }
    }
  ],
  "examples": [],
  "guidance": "Extract date properties from a date, such as day, month, year, weekday, or quarter.\n\n## Migrated examples\n#### Extracting Month From Date\n\n##### Recipe\n\n```yaml\nwrangles:\n  - extract.date_properties:\n      input: Date\n      output: Output\n      property: month_name\n```\n\n<div className=\"ww-sample-grid\">\n\n<div className=\"ww-sample-panel\">\n\n##### Input Sample\n\n_No sample available._\n\n</div>\n\n<div className=\"ww-sample-panel\">\n\n##### Output Sample\n\n| Date | Output |\n| --- | --- |\n| 1992-08-13 00:00:00 | August |\n\n</div>\n\n</div>",
  "sources": [
    {
      "id": "runtime",
      "resource": "https://github.com/wrangleworks/WranglesPY/blob/7916bf158e8b7e561270a1bea7b808f88956edc4/wrangles/recipe_wrangles/extract.py",
      "title": "WranglesPY extract.date_properties implementation"
    },
    {
      "id": "legacy-docs-archive",
      "resource": "https://github.com/wrangleworks/Wrangles-Docs/blob/6ad22fdaefc31154f38d7576e5e76746927daa69/wrangles-docs/wrangle-docs/extract/_sources/date-properties.md",
      "title": "Archived extract.date_properties Markdown"
    }
  ]
}
